id,latitude,longitude,address
13880,,,"Calle de José Fentanes, Ciudad Universitaria, Madrid"
13876,,,"Cabellera de Berenice, Valdemarín, Madrid"
13867,,,"Urb. ARAVACA, La Rinconada, Moncloa, Madrid"
13859,,,"Urb. PUERTA DE HIERRO, Moncloa, Madrid"
13855,,,"Avenida Reina Victoria, 58, Ciudad Universitaria, Madrid"
13847,,,"Calle Paradores s/n, El Plantío, Madrid"
13844,,,"amorebieta, 25, El Plantío, Madrid"
13834,,,"Calle Miguel Gila, 8, Valdemarín, Madrid"
13804,,,"Juan Alvarez Medizabal, Argüelles, Madrid"
13791,,,"Calle Santo Angel de la Guarda, 11, Valdezarza, Madrid"
13786,,,"Calle Rafael Boti, Madrid, 6, El Plantío, Madrid"
13770,,,"Urb. LA ESCORZONERA, Moncloa, Madrid"
13768,,,"Urb. ARAVACA VALDEMARÍN, Moncloa, Madrid"
13763,,,"Urb. Puerta Hierro, Moncloa, Madrid"
13762,,,"Urb. Las encinas, Moncloa, Madrid"
13761,,,"Urb. la florida, Moncloa, Madrid"
13760,,,"Urb. La Floria, Moncloa, Madrid"
13747,,,"Calle Paradores, 3, El Plantío, Madrid"
13743,,,"Calle Argentona, 8, Valdemarín, Madrid"
13737,,,"Calle de Cercis, Valdemarín, Madrid"
13729,,,"Calle Rafael Botí, El Plantío, Madrid"
13727,,,"Calle Venta Vieja, El Plantío, Madrid"
13711,,,"Urb. Camarines, Moncloa, Madrid"
13701,,,"Calle Sopelana, El Plantío, Madrid"
13698,,,"Plaza Ntra. Sra. del Buen Camino, Aravaca, Madrid"
13697,,,"Urb. Las Encinas, Moncloa, Madrid"
13686,,,"José Bastos, Valdemarín, Madrid"
13616,,,"Calle José Bastos 20 -, 30, Valdemarín, Madrid"
13607,,,"Colonia Santa María, 17, Aravaca, Madrid"
13597,,,"Calle del Doctor Juan José López Ibor, Valdezarza, Madrid"
13589,,,"Calle del Valle de Toranzo, Valdemarín, Madrid"
13588,,,"Calle Darío Aparicio, Valdemarín, Madrid"
13580,,,"Urb. DIPLÓMATICOS, Moncloa, Madrid"
13550,,,"Calle de Arroyofresno, 9, Ciudad Universitaria, Madrid"
13544,,,"Calle Molina de Aragón, 1, Aravaca, Madrid"
13542,,,"Urb. Ciudad Universitaria Everyprop.com, Moncloa, Madrid"
13537,,,"Urb. Colonia Camarines, Moncloa, Madrid"
13528,,,"Urb. Valdemarín, Moncloa, Madrid"
13518,,,"Calle Rentería, El Plantío, Madrid"
13443,,,"Calle Monasterio de El Paular, Montecarmelo, Madrid"
13438,,,"Urb. si, Fuencarral, Madrid"
13429,,,"Calle de la Virgen de Aránzazu, Tres Olivos - Valverde, Madrid"
13417,,,"Calle Monasterio de Guadalupe, Montecarmelo, Madrid"
13407,,,"Calle de la Isla Trinidad, Tres Olivos - Valverde, Madrid"
13396,,,"Calle Sandalio López, 50, Tres Olivos - Valverde, Madrid"
13381,,,"Calle Caballero de la Triste Figura, 38, Tres Olivos - Valverde, Madrid"
13370,,,"Calle del Monasterio de las Batuecas, Montecarmelo, Madrid"
13365,,,"Calle Isla Tabarca, 44, Peñagrande, Madrid"
13359,,,"Calle Buitrago del Lozoya, Peñagrande, Madrid"
13355,,,"Calle Ginzo de Limia, 60, La Paz, Madrid"
13353,,,"Calle de Nuestra Señora de Valverde, Tres Olivos - Valverde, Madrid"
13337,,,"Calle san modesto, 44, La Paz, Madrid"
13333,,,"Urb. Mirasierra Everyprop.com, Fuencarral, Madrid"
13332,,,"Urb. Peñagrande Everyprop.com, Fuencarral, Madrid"
13331,,,"Urb. Mirasierra, Fuencarral, Madrid"
13304,,,"Calle de Riscos de Polanco, 6, Peñagrande, Madrid"
13301,,,"Calle Redecilla del Camino, 9, Las Tablas, Madrid"
13294,,,"Arnedillo, Montecarmelo, Madrid"
13292,,,"Calle Afueras a Valverde, 29, Tres Olivos - Valverde, Madrid"
13289,,,"Calle Julio Montero, Tres Olivos - Valverde, Madrid"
13283,,,"Calle de San Dacio, Tres Olivos - Valverde, Madrid"
13275,,,"Calle Pena Dorada, Mirasierra, Madrid"
13271,,,"Calle Virgen de Aranzazu, 1, Tres Olivos - Valverde, Madrid"
13265,,,"San juan de Ortega, 20, Las Tablas, Madrid"
13264,,,"Urb. Montecarmelo Everyprop.com, Fuencarral, Madrid"
13252,,,"Calle Cerrillo, Tres Olivos - Valverde, Madrid"
13240,,,"Urb. puerta de Hierro, Fuencarral, Madrid"
13228,,,"Urb. FUENTELARREINA, Fuencarral, Madrid"
13222,,,"Calle Ginzo de Limia, 11, Pilar, Madrid"
13221,,,"Calle Leopoldo Alas Clarín, 15, Peñagrande, Madrid"
13218,,,"Urb. SI, Fuencarral, Madrid"
13212,,,"Calle Anastasia López, Tres Olivos - Valverde, Madrid"
13206,,,"Calle Ramon Gomez de la Serna, 141, Peñagrande, Madrid"
13204,,,"Calle Ramón Gómez de la Serna, 60, 62, Peñagrande, Madrid"
13202,,,"Calle de Isla de Formosa, Tres Olivos - Valverde, Madrid"
13198,,,"Plaza puerto de la cruz, 5 -9, Pilar, Madrid"
13196,,,"Calle Ínsula Barataria, 2, Tres Olivos - Valverde, Madrid"
13195,,,"Calle del Puerto de Maspalomas, 5, Pilar, Madrid"
13194,,,"Calle José Anduiza, Tres Olivos - Valverde, Madrid"
13176,,,"Calle de las Islas Cíes s/n, Peñagrande, Madrid"
13173,,,"Calle de Alonso Quijano, Tres Olivos - Valverde, Madrid"
13172,,,"Calle Islas Británicas, Tres Olivos - Valverde, Madrid"
13157,,,"Calle Cámaras, Tres Olivos - Valverde, Madrid"
13155,,,"Calle Santa Ana Baja, Tres Olivos - Valverde, Madrid"
13154,,,"Camaras, Tres Olivos - Valverde, Madrid"
13151,,,"Cámaras, Tres Olivos - Valverde, Madrid"
13128,,,"Calle Leopoldo Alas Clarín, Peñagrande, Madrid"
13111,,,"Calle Santuario de Valverde , 114, Montecarmelo, Madrid"
13104,,,"Calle Isla Timor, 18, Tres Olivos - Valverde, Madrid"
13102,,,"Calle Cantalejo s/n, Fuentelarreina, Madrid"
13100,,,"Paseo TIERRA DE MELIDE, Las Tablas, Madrid"
13098,,,"Donato Bañares, 2, Tres Olivos - Valverde, Madrid"
13088,,,"Calle de San Modesto, Tres Olivos - Valverde, Madrid"
13083,,,"Calle de las Islas Cíes, Peñagrande, Madrid"
13076,,,"Calle San Juan de Ortega, Las Tablas, Madrid"
13068,,,"Calle del Cerro de la Carrasqueta, Arroyo del Fresno, Madrid"
13066,,,"Calle San Juan de Ortega, 68, Las Tablas, Madrid"
13059,,,"Calle cardenio, 1, Tres Olivos - Valverde, Madrid"
13054,,,"Calle Manresa, 6, Tres Olivos - Valverde, Madrid"
13038,,,"Calle de Pico Balaitus, Peñagrande, Madrid"
13037,,,"Calle julio montero, 11, Tres Olivos - Valverde, Madrid"
13028,,,"Calle Manuel Garrido, 12, Peñagrande, Madrid"
13025,,,"Calle Boadilla del Camino, 3, Las Tablas, Madrid"
13024,,,"Plaza del Pico Salvaguardia, 7, Peñagrande, Madrid"
13021,,,"Calle SAN JUAN DE ORTEGA, Las Tablas, Madrid"
13020,,,"Calle Alfredo Marquerie, 7, La Paz, Madrid"
13017,,,"Calle del Monasterio del Paular, 9 B, Montecarmelo, Madrid"
13015,,,"Calle de Castiello de Jaca, 33, Las Tablas, Madrid"
13002,,,"Calle ISLA TRINIDAD, Tres Olivos - Valverde, Madrid"
13000,,,"Calle Islas Vírgenes, Tres Olivos - Valverde, Madrid"
12994,,,"monasterio del paular, Montecarmelo, Madrid"
12990,,,"Calle caballero de los espejos, Tres Olivos - Valverde, Madrid"
12984,,,"Ronda DEL INGENIOSO HIDALGO, Tres Olivos - Valverde, Madrid"
12979,,,"Calle Islas Británicas, 1, Tres Olivos - Valverde, Madrid"
12976,,,"Calle monasterio de caaveiro, 20, Montecarmelo, Madrid"
12975,,,"Avenida DEL CAMINO DE SANTIAGO, Las Tablas, Madrid"
12973,,,"Calle GERARDO BAENA, Tres Olivos - Valverde, Madrid"
12971,,,"Hospital de Orbigo, Las Tablas, Madrid"
12957,,,"Calle Monasterio de Montesclaros, 4, Montecarmelo, Madrid"
12955,,,"Urb. Corcubión, Fuencarral, Madrid"
12948,,,"Urb. MIRASIERRA-TELEFONICA, Fuencarral, Madrid"
12938,,,"Calle Cerrillo s/n, Tres Olivos - Valverde, Madrid"
12932,,,"Plaza del Pico Salvaguardia, Peñagrande, Madrid"
12928,,,"Avenida del Camino de Santiago, 33, Las Tablas, Madrid"
12922,,,"Calle Islas Bahamas, 21, Peñagrande, Madrid"
12919,,,"Calle Collado Mostajo, 10, Arroyo del Fresno, Madrid"
12912,,,"Calle Julio Palacios, 24, La Paz, Madrid"
12908,,,"Calle del Monasterio de las Batuecas, 21, Montecarmelo, Madrid"
12904,,,"Calle de Ángel Múgica, 15, Tres Olivos - Valverde, Madrid"
12900,,,"Calle del Monasterio de Las Huelgas, 18, Montecarmelo, Madrid"
12895,,,"Calle Julio Palacios, 31, La Paz, Madrid"
12892,,,"Calle del Monasterio de las Huelgas, 20, Montecarmelo, Madrid"
12891,,,"Calle de Puente la Reina, 39, Las Tablas, Madrid"
12889,,,"Avenida del Camino de Santiago, 45, Las Tablas, Madrid"
12888,,,"Calle de la Virgen de Aránzazu, 16, Tres Olivos - Valverde, Madrid"
12886,,,"francisco sancha, 22, Tres Olivos - Valverde, Madrid"
12885,,,"Calle Francisco Sancha, 22, Tres Olivos - Valverde, Madrid"
12884,,,"Urb. fuentelarreina, Fuencarral, Madrid"
12877,,,"Calle Sandalio López, 4, Tres Olivos - Valverde, Madrid"
12868,,,"Calle de la Peña del Cuervo, 20, Arroyo del Fresno, Madrid"
12866,,,"Calle Cebreiro, 7, Las Tablas, Madrid"
12862,,,"Calle de Celanova, 13 2º puerta 1, Pilar, Madrid"
12854,,,"Calle Badalona, 96, Tres Olivos - Valverde, Madrid"
12852,,,"Calle del Castillo de Candanchú, 8, Las Tablas, Madrid"
12846,,,"Urb. Urbanización cerrada, Fuencarral, Madrid"
12842,,,"Calle Julio Palacios, 13, La Paz, Madrid"
12838,,,"Calle Isla de Rodas, Tres Olivos - Valverde, Madrid"
12837,,,"Calle Julio Palacios, 45, La Paz, Madrid"
12832,,,"Calle Ginzo de Limia, 33, Pilar, Madrid"
12828,,,"Calle del Doctor Mediavilla, 10 BAJO A, El Pardo, Madrid"
12827,,,"hospital de orbigo, 7, Las Tablas, Madrid"
12823,,,"Urb. Fuentelarreina- Puerta de Hierro, Fuencarral, Madrid"
12820,,,"Avenida Cardenal Herrera Oria, 45, Tres Olivos - Valverde, Madrid"
12818,,,"Calle del Puerto de Maspalomas, 2, Pilar, Madrid"
12817,,,"Calle de las Islas Cíes, 34, Peñagrande, Madrid"
12814,,,"Calle del Castillo de Candanchú, 7, Las Tablas, Madrid"
12812,,,"Calle de Mataró, 21, Tres Olivos - Valverde, Madrid"
12801,,,"Calle de San Dacio, 1, Tres Olivos - Valverde, Madrid"
12800,,,"Calle de las Islas Cíes, 15, Peñagrande, Madrid"
12798,,,"Calle del Pico Balaitus, 35, Peñagrande, Madrid"
12796,,,"Calle Monasterio de Montesclaros, 9, Montecarmelo, Madrid"
12791,,,"Calle Julio Palacios, 29, La Paz, Madrid"
12790,,,"Calle de Nuestra Señora de Valverde, 86, Tres Olivos - Valverde, Madrid"
12781,,,"Calle Isla de Rodas, 26, Tres Olivos - Valverde, Madrid"
12777,,,"Calle San Julián del Camino, Las Tablas, Madrid"
12776,,,"Calle Isla Graciosa, 6, Tres Olivos - Valverde, Madrid"
12773,,,"Urb. Peñagrande, Fuencarral, Madrid"
12772,,,"Calle Santiago de Compostela, 90, Peñagrande, Madrid"
12765,,,"Urb. Tres Olivos, Fuencarral, Madrid"
12748,,,"Calle Monasterio de Guadalupe, 2, Montecarmelo, Madrid"
12741,,,"Calle Buitrago del Lozoya, 10, Peñagrande, Madrid"
12738,,,"Urb. Si, Fuencarral, Madrid"
12736,,,"Calle anastasia lópez, Tres Olivos - Valverde, Madrid"
12735,,,"Calle de San Dacio, 36, Tres Olivos - Valverde, Madrid"
12732,,,"Calle del Monasterio de las Batuecas, 20 -38, Montecarmelo, Madrid"
12730,,,"Calle Cardenuela Riopico, 9, Las Tablas, Madrid"
12724,,,"Calle Sandalio López, Tres Olivos - Valverde, Madrid"
12722,,,"Avenida Santuario de Valverde, 74, Montecarmelo, Madrid"
12712,,,"Carretera Fuencarral a Alcobendas, Las Tablas, Madrid"
12709,,,"MATARO, Tres Olivos - Valverde, Madrid"
12708,,,"Calle Redecilla del Camino, 2, Las Tablas, Madrid"
12706,,,"Calle de la Isla de los Galápagos, 5, Peñagrande, Madrid"
12697,,,"Calle de Riscos de Polanco, 4, Peñagrande, Madrid"
12693,,,"Calle FRESNADILLAS, Fuentelarreina, Madrid"
12692,,,"Calle de la Virgen de Aránzazu, 21, Tres Olivos - Valverde, Madrid"
12688,,,"Calle Ginzo de Limia, Pilar, Madrid"
12686,,,"Calle Cebreiro, 17, Las Tablas, Madrid"
12681,,,"Calle MANRESA, Tres Olivos - Valverde, Madrid"
12680,,,"Calle Gerardo Baena, 1, Tres Olivos - Valverde, Madrid"
12677,,,"Calle Julio Montero, 3, Tres Olivos - Valverde, Madrid"
12674,,,"Calle San Juan de Ortega, 92, Las Tablas, Madrid"
12673,,,"Calle Ginzo de Limia, 4, La Paz, Madrid"
12671,,,"Calle Sandalio López, 45, Tres Olivos - Valverde, Madrid"
12670,,,"Calle del Valle de Pinares Llanos, Arroyo del Fresno, Madrid"
12665,,,"Calle de Marcos de Orueta, Tres Olivos - Valverde, Madrid"
12664,,,"Calle de Isidro Fernández, Tres Olivos - Valverde, Madrid"
12662,,,"Calle del Puerto de Maspalomas, Pilar, Madrid"
12643,,,"Calle Monasterio de Montesclaros, Montecarmelo, Madrid"
12624,,,"Urb. CERCA DEL METRO, Fuencarral, Madrid"
12623,,,"Urb. Entregar en el local de Inmobiliaria Albamar., Fuencarral, Madrid"
12617,,,"Calle Donato Banares, 2, Tres Olivos - Valverde, Madrid"
12615,,,"Urb. Residencial Montelarreyna, Fuencarral, Madrid"
12614,,,"Calle Isla Trinidad, 5, Tres Olivos - Valverde, Madrid"
12612,,,"Plaza de Puerto de la Cruz, Pilar, Madrid"
12599,,,"Plaza Puerto de la Cruz, 7, Pilar, Madrid"
12582,,,"cerro de la carrasqueta s/n, Arroyo del Fresno, Madrid"
12576,,,"CANTALEJOS, Fuentelarreina, Madrid"
12575,,,"Calle del Puerto de Maspalomas, 24, Pilar, Madrid"
12564,,,"Calle monasterio de oseira, 9, Montecarmelo, Madrid"
12563,,,"Camino DE SANTIAGO, Las Tablas, Madrid"
12561,,,"Calle ROSALÍA DE CASTRO, Peñagrande, Madrid"
12559,,,"Calle del Arroyo del Monte, 111, Arroyo del Fresno, Madrid"
12556,,,"Calle del Mirador de la Reina, 32, Arroyo del Fresno, Madrid"
12549,,,"Calle Redecilla del Camino, Las Tablas, Madrid"
12548,,,"Calle Pablo Gargallo, Peñagrande, Madrid"
12532,,,"Calle del Collado de Marichiva, Arroyo del Fresno, Madrid"
12514,,,"Calle ISLA GRACIOSA, Tres Olivos - Valverde, Madrid"
12509,,,"Calle Arnedillo, Montecarmelo, Madrid"
12508,,,"Calle de Simón Viñals, 4, Tres Olivos - Valverde, Madrid"
12506,,,"Calle Costa Brava, Mirasierra, Madrid"
12488,,,"Avenida de Salas de los Infantes, 9, Tres Olivos - Valverde, Madrid"
12487,,,"Calle del Valle de Pinares Llanos s/n, Peñagrande, Madrid"
12485,,,"Calle del Cerro Minguete, Arroyo del Fresno, Madrid"
12482,,,"MONTEDEVA s/n, Arroyo del Fresno, Madrid"
12481,,,"MONTESELLA s/n, Arroyo del Fresno, Madrid"
12473,,,"Calle Alejandro Casona, Peñagrande, Madrid"
12470,,,"Avenida Santuario de Valverde, 85, Montecarmelo, Madrid"
12468,,,"CUEVA DE MONTESINOS, Tres Olivos - Valverde, Madrid"
12463,,,"Calle de Nuestra Señora de Valverde s/n, Tres Olivos - Valverde, Madrid"
12462,,,"Calle Santuario de Valverde s/n, Montecarmelo, Madrid"
12458,,,"Paseo Tierra de Melide, Las Tablas, Madrid"
12447,,,"Avenida Monforte de Lemos, Madrid, Pilar, Madrid"
12441,,,"Calle Caballero de la Triste Figura, Tres Olivos - Valverde, Madrid"
12440,,,"insula barataria, Tres Olivos - Valverde, Madrid"
12427,,,"Calle Manresa, Tres Olivos - Valverde, Madrid"
12418,,,"San Juan de Ortega, Las Tablas, Madrid"
12377,,,"Calle Isla Graciosa, Tres Olivos - Valverde, Madrid"
12371,,,"Ronda del Caballero de la Mancha, 6, Tres Olivos - Valverde, Madrid"
12370,,,"Calle Monasterio de El Paular, 146, Montecarmelo, Madrid"
12352,,,"Calle de Nuestra Señora de Valverde, 181, Tres Olivos - Valverde, Madrid"
12342,,,"Calle del Monasterio de las Batuecas, 32, Montecarmelo, Madrid"
12341,,,"Calle Cerro de Valdemartín s/n, Mirasierra, Madrid"
12339,,,"Calle Braille, Tres Olivos - Valverde, Madrid"
12336,,,"Calle de la Isla de Java, Tres Olivos - Valverde, Madrid"
12324,,,"Calle del Monasterio de las Batuecas, 23, Montecarmelo, Madrid"
12310,,,"Calle Manuel Garrido, 5, Peñagrande, Madrid"
12302,,,"Calle de la Peña del Cuervo, Arroyo del Fresno, Madrid"
12292,,,"Padormelo, Las Tablas, Madrid"
12288,,,"Calle Costa Brava , 14, Mirasierra, Madrid"
12270,,,"Calle de Adriano de Utrecht, Sanchinarro, Madrid"
12269,,,"Ronda Manuel Granero, Conde Orgaz-Piovera, Madrid"
12265,,,"Avenida de los Madroños, Conde Orgaz-Piovera, Madrid"
12262,,,"Urb. CONDE ORGAZ, Hortaleza, Madrid"
12256,,,"Calle Serramagna, Conde Orgaz-Piovera, Madrid"
12254,,,"Calle de Bueso de Pineda, Conde Orgaz-Piovera, Madrid"
12253,,,"Avenida de los Madroños, Madrid, Conde Orgaz-Piovera, Madrid"
12251,,,"Urb. LUJO., Hortaleza, Madrid"
12250,,,"Avenida Carondelet, Conde Orgaz-Piovera, Madrid"
12245,,,"Calle de Dulce Chacón, Virgen del Cortijo - Manoteras, Madrid"
12243,,,"Urb. Asura, Hortaleza, Madrid"
12242,,,"Avenida Juan Antonio Samaranch, 141, Valdebebas - Valdefuentes, Madrid"
12234,,,"JOSE MIGUEL GURIDI, Conde Orgaz-Piovera, Madrid"
12233,,,"Calle Guadalajara s/n, Palomas, Madrid"
12228,,,"Urb. conde orgaz, Hortaleza, Madrid"
12225,,,"Ronda Abubilla, Conde Orgaz-Piovera, Madrid"
12223,,,"Urb. algabeño, Hortaleza, Madrid"
12222,,,"Urb. Conde de Orgaz, Hortaleza, Madrid"
12220,,,"Urb. Arturo Soria, Hortaleza, Madrid"
12218,,,"Calle del Moscatelar s/n, Conde Orgaz-Piovera, Madrid"
12217,,,"Avenida de los madroños, 71, Conde Orgaz-Piovera, Madrid"
12215,,,"Av. Machupichu, Madrid, Conde Orgaz-Piovera, Madrid"
12207,,,"Calle Paula de la Vega, Pinar del Rey, Madrid"
12204,,,"Calle Valverde de la Virgen, Valdebebas - Valdefuentes, Madrid"
12195,,,"Avenida del Papa Negro s/n, Conde Orgaz-Piovera, Madrid"
12194,,,"Calle Julián Hernández, Conde Orgaz-Piovera, Madrid"
12188,,,"BARON DE LA TORRE, Conde Orgaz-Piovera, Madrid"
12187,,,"jose rizal, Conde Orgaz-Piovera, Madrid"
12181,,,"Calle Ana de Austria, 83, Sanchinarro, Madrid"
12176,,,"Calle Jaenar s/n, Conde Orgaz-Piovera, Madrid"
12172,,,"Calle Gómez de Baquero, Canillas, Madrid"
12171,,,"Calle Julián Hernández, Madrid, Conde Orgaz-Piovera, Madrid"
12170,,,"Ronda de Sobradiel, Conde Orgaz-Piovera, Madrid"
12169,,,"madroños, Conde Orgaz-Piovera, Madrid"
12168,,,"Calle Castillo de Aysa, 25, Conde Orgaz-Piovera, Madrid"
12167,,,"Calle Pedro Bautista Pino, Conde Orgaz-Piovera, Madrid"
12159,,,"Urb. Conde Orgaz, Hortaleza, Madrid"
12158,,,"Calle de José Rizal, Conde Orgaz-Piovera, Madrid"
12154,,,"Calle de la Toronga, Madrid, Conde Orgaz-Piovera, Madrid"
12139,,,"Calle Cardenal Tavera, Sanchinarro, Madrid"
12135,,,"Calle de las Cuevas de Almanzora, Apóstol Santiago, Madrid"
12132,,,"Calle de Balaguer, Pinar del Rey, Madrid"
12127,,,"Calle de la Toronga, Conde Orgaz-Piovera, Madrid"
12126,,,"Calle Ángel Cavero, Conde Orgaz-Piovera, Madrid"
12113,,,"Calle de José Rizal, Madrid, Conde Orgaz-Piovera, Madrid"
12106,,,"Calle Olimpo, Conde Orgaz-Piovera, Madrid"
12105,,,"Urb. chalet 1, Hortaleza, Madrid"
12102,,,"Calle de Cuevas de Almanzora, 77, Apóstol Santiago, Madrid"
12100,,,"Calle de Francisco Mosqueda, Conde Orgaz-Piovera, Madrid"
12089,,,"LIDO, 7, Conde Orgaz-Piovera, Madrid"
12083,,,"Avenida del Papa Negro, 7, Conde Orgaz-Piovera, Madrid"
12080,,,"Avenida MACHUPICHU, Conde Orgaz-Piovera, Madrid"
12078,,,"Calle Andes, 23, Conde Orgaz-Piovera, Madrid"
12077,,,"Calle Grama, 62, Valdebebas - Valdefuentes, Madrid"
12076,,,"Calle Uría, Pinar del Rey, Madrid"
12057,,,"MACHUPICHU, Conde Orgaz-Piovera, Madrid"
12056,,,"Avenida de Secundino Zuazo, Valdebebas - Valdefuentes, Madrid"
12053,,,"Avenida Manuel Fraga Iribarne, 38, Valdebebas - Valdefuentes, Madrid"
12049,,,"Avenida del Papa Negro, 119, Conde Orgaz-Piovera, Madrid"
12046,,,"Calle Princesa de Éboli, Sanchinarro, Madrid"
12044,,,"Calle de Dulce Chacón, 45, Virgen del Cortijo - Manoteras, Madrid"
12042,,,"Camino Olivar, Valdebebas - Valdefuentes, Madrid"
12037,,,"Avenida machupichu, Conde Orgaz-Piovera, Madrid"
12032,,,"Machaquito, Conde Orgaz-Piovera, Madrid"
12031,,,"Calle de Carmen Rico Godoy, Valdebebas - Valdefuentes, Madrid"
12028,,,"Avenida Virgen del Carmen, Pinar del Rey, Madrid"
12024,,,"Camino del olivar, Valdebebas - Valdefuentes, Madrid"
12019,,,"Calle de las Cuevas de Almanzora, 55, Apóstol Santiago, Madrid"
12005,,,"Avenida Machupichu, Conde Orgaz-Piovera, Madrid"
12002,,,"Urb. Privada con piscina, área deportiva, seguridad 24h, Hortaleza, Madrid"
11996,,,"Calle Ricardo San Juan, Canillas, Madrid"
11988,,,"Urb. RESIDENCIAL GUADALUPE, Hortaleza, Madrid"
11986,,,"Urb. Los Apolos, Hortaleza, Madrid"
11982,,,"Gran Vía de Hortaleza, 54, Canillas, Madrid"
11976,,,"Calle Murias de Paredes, Valdebebas - Valdefuentes, Madrid"
11973,,,"Calle Mahonia, Conde Orgaz-Piovera, Madrid"
11970,,,"Calle Rogelio Muñoz s/n, Pinar del Rey, Madrid"
11966,,,"Urb. Campo de las Naciones, Hortaleza, Madrid"
11956,,,"Avenida de los madroños, Conde Orgaz-Piovera, Madrid"
11953,,,"Calle de Cuevas de Almanzora, Apóstol Santiago, Madrid"
11948,,,"Calle del Santo Ángel, Madrid, Canillas, Madrid"
11930,,,"Calle Jordi Solé Tura, 8, Valdebebas - Valdefuentes, Madrid"
11928,,,"Lavanda, Valdebebas - Valdefuentes, Madrid"
11911,,,"Av. de Machupichu, Conde Orgaz-Piovera, Madrid"
11910,,,"CESAR CORT BOTI, 85, Valdebebas - Valdefuentes, Madrid"
11899,,,"Calle DE JOSÉ RIZAL, Conde Orgaz-Piovera, Madrid"
11890,,,"Calle Paula de la vega, 10, Pinar del Rey, Madrid"
11888,,,"Calle José Antonio Fernández Ordóñez, 38, Valdebebas - Valdefuentes, Madrid"
11886,,,"Calle Mª de las Mercedes de Borbón esq c/ Jordi Solé Tura s/n, Valdebebas - Valdefuentes, Madrid"
11881,,,"Urb. Conde de Orgaz - Piovera, Hortaleza, Madrid"
11875,,,"Urb. No mostrar dirección, Hortaleza, Madrid"
11861,,,"Urb. PARQUE CONDE DE ORGAZ, Hortaleza, Madrid"
11859,,,"Calle DE BUESO DE PINEDA, Conde Orgaz-Piovera, Madrid"
11857,,,"Calle José Miguel Guridi, Conde Orgaz-Piovera, Madrid"
11853,,,"Calle María de las Mercedes de Borbón, 196, 204, Valdebebas - Valdefuentes, Madrid"
11839,,,"Calle de José Rizal, 47, Conde Orgaz-Piovera, Madrid"
11838,,,"Calle Madroños, 29, Conde Orgaz-Piovera, Madrid"
11806,,,"Calle Roquetas de Mar s/n, Apóstol Santiago, Madrid"
11794,,,"Urb. Valdebebas - Hortaleza, Hortaleza, Madrid"
11793,,,"Urb. Campo de las Naciones - Palomas, Hortaleza, Madrid"
11786,,,"Urb. Puerta de Chamartín, Hortaleza, Madrid"
11781,,,"Avenida Francisco Pi y Margal, 79, Sanchinarro, Madrid"
11776,,,"Calle Rafaela Aparicio, Valdebebas - Valdefuentes, Madrid"
11773,,,"Calle del Olivar, 2, Valdebebas - Valdefuentes, Madrid"
11772,,,"Gran Vía de Hortaleza, 50, Canillas, Madrid"
11732,,,"Calle del Moscatelar, Conde Orgaz-Piovera, Madrid"
11731,,,"Avenida de los Madroños , 27, Conde Orgaz-Piovera, Madrid"
11726,,,"Calle MANUEL COMÍN, Conde Orgaz-Piovera, Madrid"
11722,,,"Calle de Machaquito, Conde Orgaz-Piovera, Madrid"
11719,,,"Avenida de Secundino Zuazo, 20, Valdebebas - Valdefuentes, Madrid"
11716,,,"Ronda de Cala Basa, Conde Orgaz-Piovera, Madrid"
11715,,,"Calle Calasparra, Pinar del Rey, Madrid"
11712,,,"Calle Parma, Conde Orgaz-Piovera, Madrid"
11708,,,"Calle Gustavo Pérez Puig, 8, Valdebebas - Valdefuentes, Madrid"
11705,,,"Calle Santa Virgilia, 19, Pinar del Rey, Madrid"
11701,,,"Calle de César Cort Botí, Valdebebas - Valdefuentes, Madrid"
11700,,,"Calle Juan Belmonte, Madrid, Conde Orgaz-Piovera, Madrid"
11699,,,"Calle Rafaela Aparicio, 14, Valdebebas - Valdefuentes, Madrid"
11696,,,"Calle de José Rizal, 174, Conde Orgaz-Piovera, Madrid"
11693,,,"Manuel Pombo Angulo s/n, Sanchinarro, Madrid"
11689,,,"Calle Manuel Pombo Angulo, Sanchinarro, Madrid"
11688,,,"Calle de Pegaso, Canillas, Madrid"
11684,,,"Avenida de Machupichu, Conde Orgaz-Piovera, Madrid"
11677,,,"Calle isabel de valois, 82, Sanchinarro, Madrid"
11674,,,"Calle Princesa de Éboli, 9, Sanchinarro, Madrid"
11672,,,"Calle Vélez Rubio, 80, Apóstol Santiago, Madrid"
11671,,,"Calle de Oña, Virgen del Cortijo - Manoteras, Madrid"
11663,,,"Calle Baranoa, Pinar del Rey, Madrid"
11660,,,"Avenida de Machupichu, 11, Conde Orgaz-Piovera, Madrid"
11656,,,"Calle de Florencio Castillo, 48, Conde Orgaz-Piovera, Madrid"
11653,,,"Plaza Liceo, 3, Conde Orgaz-Piovera, Madrid"
11652,,,"Calle Sanlúcar de Barrameda, 10, Pinar del Rey, Madrid"
11649,,,"Avenida Papa negro, Conde Orgaz-Piovera, Madrid"
11646,,,"Calle Vizconde de Uzqueta, 2, Palomas, Madrid"
11645,,,"Calle Vicente Morales, 2, Conde Orgaz-Piovera, Madrid"
11633,,,"Calle del Estrecho de Mesina, Madrid, Conde Orgaz-Piovera, Madrid"
11627,,,"Calle Princesa de Éboli, 24, Sanchinarro, Madrid"
11626,,,"Urb. Palomas - Piovera, Hortaleza, Madrid"
11623,,,"Calle de Valdetorres de Jarama, 9, Pinar del Rey, Madrid"
11615,,,"Calle Vélez Rubio, Apóstol Santiago, Madrid"
11613,,,"Calle Santa Susana, 44, Pinar del Rey, Madrid"
11612,,,"Calle Vizonde de Uzqueta, 2, Palomas, Madrid"
11610,,,"Calle Santa Susana, 32, Pinar del Rey, Madrid"
11609,,,"Calle de los Hermanos Gascón, 3, Valdebebas - Valdefuentes, Madrid"
11607,,,"Calle de Dulce Chacón, 33, Virgen del Cortijo - Manoteras, Madrid"
11606,,,"Calle de Oña, 93, Virgen del Cortijo - Manoteras, Madrid"
11605,,,"Calle Grama, 56, Valdebebas - Valdefuentes, Madrid"
11600,,,"Calle de Valdetorres de Jarama, 6, Pinar del Rey, Madrid"
11599,,,"Calle Luis Jiménez de Asúa, 31, Sanchinarro, Madrid"
11598,,,"Calle de Adriano de Utrecht, 1, Sanchinarro, Madrid"
11585,,,"Calle de Oña, 7, Virgen del Cortijo - Manoteras, Madrid"
11583,,,"Avenida de los Andes, 23, Conde Orgaz-Piovera, Madrid"
11581,,,"Calle de Oña, 13, Virgen del Cortijo - Manoteras, Madrid"
11579,,,"Calle de Andorra, 100 -115, Canillas, Madrid"
11577,,,"Calle de Félix Candela, 65, Valdebebas - Valdefuentes, Madrid"
11575,,,"Avenida de los Madroños, 27, Conde Orgaz-Piovera, Madrid"
11574,,,"Calle de Navaleno, 5, Apóstol Santiago, Madrid"
11570,,,"Calle dulce chacon, 23, Virgen del Cortijo - Manoteras, Madrid"
11549,,,"Calle Santa Susana, 33, Pinar del Rey, Madrid"
11545,,,"Calle Paula de la Vega, 10, Pinar del Rey, Madrid"
11542,,,"Calle de la Grama, 44, Valdebebas - Valdefuentes, Madrid"
11538,,,"Calle Grama, Valdebebas - Valdefuentes, Madrid"
11535,,,"Calle Francisco Palomo, Madrid, Pinar del Rey, Madrid"
11532,,,"Urb. Delicias 21, 5ºB, Hortaleza, Madrid"
11528,,,"Avenida Machupichu, 31, Conde Orgaz-Piovera, Madrid"
11527,,,"Calle del Pintor Antonio Saura, 2, Sanchinarro, Madrid"
11519,,,"Calle Manuel Pombo Angulo, 12, Sanchinarro, Madrid"
11514,,,"Urb. ESPERANZA, Hortaleza, Madrid"
11507,,,"Calle de Bueso de Pineda, 55, Conde Orgaz-Piovera, Madrid"
11506,,,"Calle Dulce Chacón, 45, Virgen del Cortijo - Manoteras, Madrid"
11504,,,"Calle Santa Virgilia, 12, Pinar del Rey, Madrid"
11501,,,"Calle Gran Via de Hortaleza, 5, Pinar del Rey, Madrid"
11500,,,"Calle de Dulce Chacón, 23, Virgen del Cortijo - Manoteras, Madrid"
11499,,,"Calle Princesa de Éboli, 94, Sanchinarro, Madrid"
11494,,,"Urb. Urbanizacion EL BOSQUE, Hortaleza, Madrid"
11491,,,"Urb. Parque Conde de Orgaz, Hortaleza, Madrid"
11490,,,"carrión de los condes, 50, Apóstol Santiago, Madrid"
11488,,,"Calle Manuel Pombo Angulo, 24, Sanchinarro, Madrid"
11486,,,"Calle Manuel Pombo Angulo, 18, Sanchinarro, Madrid"
11483,,,"Calle del Estrecho de Mesina, 13, Conde Orgaz-Piovera, Madrid"
11482,,,"Calle santa virgilia, 29, Pinar del Rey, Madrid"
