id,latitude,longitude,address
11481,,,"Calle de Navaleno, 17, Apóstol Santiago, Madrid"
11479,,,"Calle Rafaela Aparicio, 10, Valdebebas - Valdefuentes, Madrid"
11478,,,"Calle de Oña, 157, Virgen del Cortijo - Manoteras, Madrid"
11477,,,"Calle de Machaquito, 58, Conde Orgaz-Piovera, Madrid"
11474,,,"Calle Olimpo, 33, Conde Orgaz-Piovera, Madrid"
11473,,,"Calle de Esteban Palacios, 7, Conde Orgaz-Piovera, Madrid"
11463,,,"Avenida de Francisco Javier Sáenz de Oiza, 46, Valdebebas - Valdefuentes, Madrid"
11459,,,"Avenida de Secundino Zuazo, 4, Valdebebas - Valdefuentes, Madrid"
11453,,,"Avenida jose antonio samaranch, Valdebebas - Valdefuentes, Madrid"
11449,,,"Calle Olimpo, 33 exterior, Conde Orgaz-Piovera, Madrid"
11437,,,"Calle Princesa de Éboli, Madrid, 16, Sanchinarro, Madrid"
11434,,,"Calle Francisco Palomo, Pinar del Rey, Madrid"
11416,,,"Calle de Alonso Saavedra, Madrid, Apóstol Santiago, Madrid"
11409,,,"Calle Bacares, 40, Apóstol Santiago, Madrid"
11408,,,"Calle Alfacar, Pinar del Rey, Madrid"
11406,,,"Avenida de Machupichu, 37, Conde Orgaz-Piovera, Madrid"
11404,,,"Avenida del Papa Negro, Madrid, Conde Orgaz-Piovera, Madrid"
11400,,,"Avenida VIRGEN DEL CARMEN, Pinar del Rey, Madrid"
11391,,,"Avenida Francisco Javier Sáenz de Oiza confluencia Fina de Calderón y Félix Candela s/n, Valdebebas - Valdefuentes, Madrid"
11389,,,"Urb. Sanchinarro, Hortaleza, Madrid"
11388,,,"Calle Joaquín Cimas, Pinar del Rey, Madrid"
11387,,,"Calle Princesa de Éboli, 102, Sanchinarro, Madrid"
11376,,,"Calle de Dulce Chacón, 39, Virgen del Cortijo - Manoteras, Madrid"
11369,,,"Calle Miguel Ángel Asturias, 6, Sanchinarro, Madrid"
11367,,,"Calle Vélez Rubio, 183, Apóstol Santiago, Madrid"
11361,,,"Calle de Solsona, 12, Pinar del Rey, Madrid"
11356,,,"Calle de Bueso de Pineda, 62, Conde Orgaz-Piovera, Madrid"
11355,,,"Plaza Manuel Rodrigo, 11, Conde Orgaz-Piovera, Madrid"
11353,,,"Calle Dionisio Inca Yupanqui, 17, Conde Orgaz-Piovera, Madrid"
11348,,,"Avenida Carondelet, 18, Conde Orgaz-Piovera, Madrid"
11340,,,"Calle Calle Prov Parque Valdebebas 21, 63, 21, Valdebebas - Valdefuentes, Madrid"
11335,,,"Calle Papa Negro, Conde Orgaz-Piovera, Madrid"
11325,,,"Calle del Andarríos, Conde Orgaz-Piovera, Madrid"
11318,,,"Calle Lido, Conde Orgaz-Piovera, Madrid"
11299,,,"Dulce Chacon, Virgen del Cortijo - Manoteras, Madrid"
11292,,,"Calle Cardenal Tavera, 4, Sanchinarro, Madrid"
11287,,,"Calle Américo Castro, 114, Sanchinarro, Madrid"
11286,,,"Calle Ana de Austria, 51, Sanchinarro, Madrid"
11250,,,"Avenida de los Madroños, 19, Conde Orgaz-Piovera, Madrid"
11244,,,"Carondelet, Conde Orgaz-Piovera, Madrid"
11243,,,"Avenida Papa Negro, Conde Orgaz-Piovera, Madrid"
11235,,,"Calle de Canapiare, Pinar del Rey, Madrid"
11231,,,"Ronda de la Avutarda, Madrid, Conde Orgaz-Piovera, Madrid"
11227,,,"Ronda de la Avutarda, 28043, Conde Orgaz-Piovera, Madrid"
11222,,,"Calle de Montemayor de Pililla, Canillas, Madrid"
11213,,,"Calle de Esteban Palacios, Conde Orgaz-Piovera, Madrid"
11210,,,"Calle Hipólito Aragonés, Valdebebas - Valdefuentes, Madrid"
11207,,,"Calle Carmen Rico Godoy, 124, Valdebebas - Valdefuentes, Madrid"
11182,,,"Calle DE DULCE CHACÓN, Virgen del Cortijo - Manoteras, Madrid"
11179,,,"Calle Antonio Larrazabal, 25, Conde Orgaz-Piovera, Madrid"
11178,,,"Estanislao Gómez, LA PIOVERA s/n, Palomas, Madrid"
11177,,,"Avenida de la Gran Vía Hortaleza, Pinar del Rey, Madrid"
11175,,,"Calle de Josefina Carabias, Valdebebas - Valdefuentes, Madrid"
11174,,,"Urb. Parque Conde Orgaz, Hortaleza, Madrid"
11173,,,"Camino de Montoro s/n, Valdebebas - Valdefuentes, Madrid"
11169,,,"dulce chacon, Virgen del Cortijo - Manoteras, Madrid"
11157,,,"Calle Mar de Omán s/n, Pinar del Rey, Madrid"
11156,,,"Calle de Pegaso, 15, Canillas, Madrid"
11155,,,"Calle del Andarríos, 9, Conde Orgaz-Piovera, Madrid"
11150,,,"Calle de el Algabeño, Conde Orgaz-Piovera, Madrid"
11149,,,"Avenida de los Andes, Madrid, Conde Orgaz-Piovera, Madrid"
11148,,,"Avenida de los madroños, 27, Conde Orgaz-Piovera, Madrid"
11142,,,"Calle del Andarríos, Madrid, 9, Conde Orgaz-Piovera, Madrid"
11141,,,"Gran Vía de Hortaleza, Canillas, Madrid"
11140,,,"Calle de Maragatería, 78, Valdebebas - Valdefuentes, Madrid"
11139,,,"Calle RAFAELA APARICIO, Valdebebas - Valdefuentes, Madrid"
11136,,,"Avad. Francisco Pi y Margall, Sanchinarro, Madrid"
11135,,,"Avenida del Papa Negro, Conde Orgaz-Piovera, Madrid"
11117,,,"Calle de Navaleno, 8, Apóstol Santiago, Madrid"
11115,,,"Calle de Cuevas de Almanzora, 28, Apóstol Santiago, Madrid"
11111,,,"Ronda de la Avutarda, Conde Orgaz-Piovera, Madrid"
11107,,,"Calle Mar de Omán, Pinar del Rey, Madrid"
11106,,,"Calle Ana de Austria, Sanchinarro, Madrid"
11102,,,"Machupichu, Conde Orgaz-Piovera, Madrid"
11101,,,"chicuelo, Conde Orgaz-Piovera, Madrid"
11100,,,"Calle de José Rizal, Madrid, 79, Conde Orgaz-Piovera, Madrid"
11099,,,"jose miguel guridi, Conde Orgaz-Piovera, Madrid"
11098,,,"Avenida de Machupichu, 24, Conde Orgaz-Piovera, Madrid"
11095,,,"Calle de Alonso Saavedra, Apóstol Santiago, Madrid"
11082,,,"Avenida de la Abubilla s/n, Conde Orgaz-Piovera, Madrid"
11081,,,"Cacabelos, 53, Valdebebas - Valdefuentes, Madrid"
11080,,,"Calle jaenar, Conde Orgaz-Piovera, Madrid"
11069,,,"Esteban Palacios, Conde Orgaz-Piovera, Madrid"
11067,,,"Calle Aldaya, Pinar del Rey, Madrid"
11052,,,"Calle de José Rizal, 79, Conde Orgaz-Piovera, Madrid"
11051,,,"Ronda Manuel Granero, 69, Conde Orgaz-Piovera, Madrid"
11049,,,"machupichu, Conde Orgaz-Piovera, Madrid"
11047,,,"Ronda de la Abubilla, Conde Orgaz-Piovera, Madrid"
11035,,,"Calle Serramagna, Madrid, Conde Orgaz-Piovera, Madrid"
10999,,,"Calle de los Hermanos Gascón, 36, Valdebebas - Valdefuentes, Madrid"
10994,,,"Calle Cardenal Tavera, 2, Sanchinarro, Madrid"
10993,,,"Calle Serramagna, 6, Conde Orgaz-Piovera, Madrid"
10991,,,"algabeño, 53, Conde Orgaz-Piovera, Madrid"
10988,,,"Calle Francisco José Arroyo, Palomas, Madrid"
10982,,,"Urb. Conde Orgaz Everyprop.com, Hortaleza, Madrid"
10969,,,"Pombo Angulo, Sanchinarro, Madrid"
10968,,,"Calle Arzúa, Pinar del Rey, Madrid"
10965,,,"Calle Rafaela Aparicio, 14 B, Valdebebas - Valdefuentes, Madrid"
10954,,,"Calle Barón de la Torre, Conde Orgaz-Piovera, Madrid"
10933,,,"Princesa de Evoli, Sanchinarro, Madrid"
10905,,,"Pombo Angulo s/n, Sanchinarro, Madrid"
10904,,,"Urb. Urbanizacion Guadalupe, Hortaleza, Madrid"
10901,,,"Calle Pedro Romero, Conde Orgaz-Piovera, Madrid"
10886,,,"Andarrios, Conde Orgaz-Piovera, Madrid"
10885,,,"Ronda Abubilla, Madrid, Conde Orgaz-Piovera, Madrid"
10879,,,"Calle Liberación, 9, Pinar del Rey, Madrid"
10872,,,"Calle del Andarríos s/n, Conde Orgaz-Piovera, Madrid"
10841,,,"Avenida Papa Negro, Madrid, Conde Orgaz-Piovera, Madrid"
10805,,,"Calle Juan de Austria, Trafalgar, Madrid"
10802,,,"Calle Agustín de Betancourt, 23, Nuevos Ministerios-Ríos Rosas, Madrid"
10799,,,"Calle de María de Guzmán, Nuevos Ministerios-Ríos Rosas, Madrid"
10786,,,"Calle de Alonso Cano, Nuevos Ministerios-Ríos Rosas, Madrid"
10778,,,"Calle SANTA ENGRACIA, Nuevos Ministerios-Ríos Rosas, Madrid"
10776,,,"Calle ALENZA, Nuevos Ministerios-Ríos Rosas, Madrid"
10762,,,"Calle Ponzano, Nuevos Ministerios-Ríos Rosas, Madrid"
10759,,,"Urb. Almagro Prime, Chamberí, Madrid"
10734,,,"Calle de Ponzano, Nuevos Ministerios-Ríos Rosas, Madrid"
10709,,,"Calle de Santa Engracia, Nuevos Ministerios-Ríos Rosas, Madrid"
10707,,,"Calle de Maudes, Nuevos Ministerios-Ríos Rosas, Madrid"
10703,,,"Paseo San Francisco de Sales, Vallehermoso, Madrid"
10688,,,"Raimundo Fernandez Villaverde, Nuevos Ministerios-Ríos Rosas, Madrid"
10653,,,"Calle de Ríos Rosas, Nuevos Ministerios-Ríos Rosas, Madrid"
10652,,,"Calle general asensio cabanillas, Vallehermoso, Madrid"
10649,,,"MODESTO LA FUENTE, Nuevos Ministerios-Ríos Rosas, Madrid"
10644,,,"Calle de Espronceda, Nuevos Ministerios-Ríos Rosas, Madrid"
10638,,,"ponzano, Nuevos Ministerios-Ríos Rosas, Madrid"
10627,,,"Calle Hilarión Eslava, 20, Gaztambide, Madrid"
10625,,,"Calle de Ponzano, 69, Nuevos Ministerios-Ríos Rosas, Madrid"
10608,,,"PONZANO, Nuevos Ministerios-Ríos Rosas, Madrid"
10574,,,"rio rosas, 48, Nuevos Ministerios-Ríos Rosas, Madrid"
10570,,,"Calle del Marqués del Vasto, Nuevos Ministerios-Ríos Rosas, Madrid"
10560,,,"Urb. RÍOS ROSAS, Chamberí, Madrid"
10550,,,"Calle de José Abascal, 49, Nuevos Ministerios-Ríos Rosas, Madrid"
10533,,,"Calle de Bretón de los Herreros, Nuevos Ministerios-Ríos Rosas, Madrid"
10532,,,"Calle de Ríos Rosas, 29, Nuevos Ministerios-Ríos Rosas, Madrid"
10512,,,"Calle Santa Engracia, 32, Almagro, Madrid"
10511,,,"Calle García de Paredes, 64, Almagro, Madrid"
10491,,,"Calle BRAVO MURILLO, Vallehermoso, Madrid"
10488,,,"BRAVO MURILLO, Nuevos Ministerios-Ríos Rosas, Madrid"
10485,,,"Calle de Alenza, 5, Nuevos Ministerios-Ríos Rosas, Madrid"
10482,,,"Calle Hilarión Eslava, 26, Gaztambide, Madrid"
10480,,,"Calle de Zurbano, 92, Nuevos Ministerios-Ríos Rosas, Madrid"
10471,,,"Calle DE MODESTO DE LA FUENTE, Nuevos Ministerios-Ríos Rosas, Madrid"
10411,,,"Calle de Cristóbal Bordiú, 46, Nuevos Ministerios-Ríos Rosas, Madrid"
10405,,,"Calle de Ríos Rosas, 31, Nuevos Ministerios-Ríos Rosas, Madrid"
10403,,,"Paseo general martinez campos, Almagro, Madrid"
10402,,,"Calle Zurbano, Nuevos Ministerios-Ríos Rosas, Madrid"
10391,,,"Calle Santa Engracia, 43, Trafalgar, Madrid"
10378,,,"Calle de Cristóbal Bordiú, Nuevos Ministerios-Ríos Rosas, Madrid"
10365,,,"Urb. Almagro, Chamberí, Madrid"
10363,,,"Urb. Mostrar dirección aproximada, Chamberí, Madrid"
10353,,,"Calle del Marqués del Vasto, 3, Nuevos Ministerios-Ríos Rosas, Madrid"
10350,,,"Calle de Modesto Lafuente, Nuevos Ministerios-Ríos Rosas, Madrid"
10349,,,"Calle de García Paredes, Trafalgar, Madrid"
10346,,,"Calle Eloy Gonzalo, 19, Trafalgar, Madrid"
10333,,,"Calle Ríos Rosas, 54, Nuevos Ministerios-Ríos Rosas, Madrid"
10328,,,"Calle Fernando Católico, Madrid, 88, Gaztambide, Madrid"
10318,,,"Calle Vargas, Nuevos Ministerios-Ríos Rosas, Madrid"
10293,,,"Paseo San Francisco de Sales, 23, Vallehermoso, Madrid"
10254,,,"Calle de Ríos Rosas, 19, Nuevos Ministerios-Ríos Rosas, Madrid"
10244,,,"Calle gral arrando, Almagro, Madrid"
10232,,,"Calle Donoso Cortés, 19, Arapiles, Madrid"
10220,,,"Calle Robledillo, 6, Nuevos Ministerios-Ríos Rosas, Madrid"
10217,,,"Calle de Raimundo Fernández Villaverde, Madrid, Nuevos Ministerios-Ríos Rosas, Madrid"
10211,,,"Calle DE BRETÓN DE LOS HERREROS, Nuevos Ministerios-Ríos Rosas, Madrid"
10205,,,"Calle de Santa Engracia, 158, Nuevos Ministerios-Ríos Rosas, Madrid"
10198,,,"Urb. Salamanca Prime, Chamberí, Madrid"
10179,,,"Calle Donoso Cortés, 11, Arapiles, Madrid"
10171,,,"Calle de Espronceda, 8, Nuevos Ministerios-Ríos Rosas, Madrid"
10168,,,"Calle de Espronceda, 22, Nuevos Ministerios-Ríos Rosas, Madrid"
10162,,,"BRAVO MURILLO/RIOS ROSAS, Nuevos Ministerios-Ríos Rosas, Madrid"
10154,,,"Calle de Cristóbal Bordiú, 11, Nuevos Ministerios-Ríos Rosas, Madrid"
10146,,,"Calle de Ríos Rosas, 54, Nuevos Ministerios-Ríos Rosas, Madrid"
10143,,,"JOSE ABASCAL, Nuevos Ministerios-Ríos Rosas, Madrid"
10109,,,"maria panes, 14, Nuevos Ministerios-Ríos Rosas, Madrid"
10098,,,"Calle MAUDES, Nuevos Ministerios-Ríos Rosas, Madrid"
10086,,,"Calle María Panes, Nuevos Ministerios-Ríos Rosas, Madrid"
10075,,,"Calle de Don Álvaro de Bazán, 13, Nuevos Ministerios-Ríos Rosas, Madrid"
10047,,,"Urb. Distrito Chamberí, Chamberí, Madrid"
10032,,,"Calle Donoso Cortés, 83, Gaztambide, Madrid"
10031,,,"Calle de Zurbano, 96, Nuevos Ministerios-Ríos Rosas, Madrid"
10027,,,"Calle María Panes, 14, Nuevos Ministerios-Ríos Rosas, Madrid"
10023,,,"Calle Marqués de Lema, 13, Vallehermoso, Madrid"
10021,,,"Calle de María de Guzmán, 29, Nuevos Ministerios-Ríos Rosas, Madrid"
10013,,,"Urb. GALILEO, Chamberí, Madrid"
10010,,,"Calle Hilarión Eslava, 47, Gaztambide, Madrid"
10009,,,"Calle de Bretón de los Herreros, 59, Nuevos Ministerios-Ríos Rosas, Madrid"
9994,,,"Calle de Espronceda, 16, Nuevos Ministerios-Ríos Rosas, Madrid"
9993,,,"Calle de Espronceda, 14, Nuevos Ministerios-Ríos Rosas, Madrid"
9984,,,"Calle Blasco de Garay, 50, Arapiles, Madrid"
9973,,,"Calle de Alonso Cano, 46, Nuevos Ministerios-Ríos Rosas, Madrid"
9963,,,"Calle de Bretón de los Herreros, 37, Nuevos Ministerios-Ríos Rosas, Madrid"
9942,,,"Calle de maría de guzmán, Nuevos Ministerios-Ríos Rosas, Madrid"
9931,,,"Calle Donoso Cortés, 80, Gaztambide, Madrid"
9929,,,"Calle Lucio del Valle, 5, Vallehermoso, Madrid"
9926,,,"Calle de Bretón de los Herreros, 58, Nuevos Ministerios-Ríos Rosas, Madrid"
9923,,,"Calle Arcipreste de Hita, 6, Gaztambide, Madrid"
9920,,,"Calle donoso cortés, 56, Gaztambide, Madrid"
9914,,,"Calle Manuel González Longoria, 7, Trafalgar, Madrid"
9910,,,"Calle Castillo Piñeiro, 5, Vallehermoso, Madrid"
9909,,,"Calle Meléndez Valdés, 19, Arapiles, Madrid"
9907,,,"Calle de Santa Engracia, 147, Nuevos Ministerios-Ríos Rosas, Madrid"
9906,,,"Calle Rafael Calvo, 28, Almagro, Madrid"
9895,,,"Calle de Bretón de los Herreros, 10, Nuevos Ministerios-Ríos Rosas, Madrid"
9875,,,"Calle de Ríos Rosas, 49, Nuevos Ministerios-Ríos Rosas, Madrid"
9868,,,"María de guzmán, 56, Nuevos Ministerios-Ríos Rosas, Madrid"
9867,,,"Calle Vargas, 3, Nuevos Ministerios-Ríos Rosas, Madrid"
9866,,,"Calle de Alonso Cano, 99, Nuevos Ministerios-Ríos Rosas, Madrid"
9864,,,"Plaza del Descubridor Diego de Ordás, 1, Nuevos Ministerios-Ríos Rosas, Madrid"
9863,,,"Calle de Santa Engracia, 167, Nuevos Ministerios-Ríos Rosas, Madrid"
9853,,,"Calle raimundo lulio, 22, Trafalgar, Madrid"
9850,,,"Calle de Bretón de los Herreros, 8, Nuevos Ministerios-Ríos Rosas, Madrid"
9828,,,"Calle Cristóbal bordiu, 30, Nuevos Ministerios-Ríos Rosas, Madrid"
9824,,,"Calle de Cristóbal Bordiú, 13, Nuevos Ministerios-Ríos Rosas, Madrid"
9821,,,"Calle Calvo Asensio, 4, Gaztambide, Madrid"
9811,,,"Calle de Alonso Cano, 77, Nuevos Ministerios-Ríos Rosas, Madrid"
9779,,,"Calle Donoso Cortés, 70, Gaztambide, Madrid"
9769,,,"Calle de Bretón de los Herreros, 56, Nuevos Ministerios-Ríos Rosas, Madrid"
9765,,,"Calle de Maudes, 8, Nuevos Ministerios-Ríos Rosas, Madrid"
9761,,,"Calle María Panes, 9, Nuevos Ministerios-Ríos Rosas, Madrid"
9758,,,"Calle de Santa Engracia, 126, Nuevos Ministerios-Ríos Rosas, Madrid"
9756,,,"Calle de Bretón de los Herreros, 9, Nuevos Ministerios-Ríos Rosas, Madrid"
9751,,,"Calle de Fernández de la Hoz, 57, Nuevos Ministerios-Ríos Rosas, Madrid"
9730,,,"Calle de Ponzano, 93, Nuevos Ministerios-Ríos Rosas, Madrid"
9728,,,"Calle de Ríos Rosas, 48, Nuevos Ministerios-Ríos Rosas, Madrid"
9714,,,"Plaza del Descubridor Diego de Ordás, Nuevos Ministerios-Ríos Rosas, Madrid"
9713,,,"Jose Abascal, Nuevos Ministerios-Ríos Rosas, Madrid"
9709,,,"Calle García de Paredes, Almagro, Madrid"
9692,,,"Calle Joaquin Maria Lopez, Gaztambide, Madrid"
9691,,,"Calle Zurbano, 98, Nuevos Ministerios-Ríos Rosas, Madrid"
9664,,,"zurbano, 100, Nuevos Ministerios-Ríos Rosas, Madrid"
9637,,,"Calle Alfonso X, 4, Almagro, Madrid"
9613,,,"Calle Eloy Gonzalo IGLESIA, Trafalgar, Madrid"
9605,,,"Calle María de Guzmán, 38, Nuevos Ministerios-Ríos Rosas, Madrid"
9600,,,"Calle Breton de los Herreros, 44, Nuevos Ministerios-Ríos Rosas, Madrid"
9597,,,"Calle Manuel González Longoria, 10, Trafalgar, Madrid"
9588,,,"Calle de Bretón de los Herreros s/n, Nuevos Ministerios-Ríos Rosas, Madrid"
9573,,,"Calle de Santa Engracia, 163, Nuevos Ministerios-Ríos Rosas, Madrid"
9571,,,"Calle Francisco de Ricci , 13, Gaztambide, Madrid"
9548,,,"Calle Eloy Gonzalo, 21, Trafalgar, Madrid"
9542,,,"Calle Arcipreste de Hita, Gaztambide, Madrid"
9530,,,"MAUDES, 8, Nuevos Ministerios-Ríos Rosas, Madrid"
9528,,,"Calle Rafale Calvo, 18, Almagro, Madrid"
9521,,,"RIOS ROSAS, Nuevos Ministerios-Ríos Rosas, Madrid"
9507,,,"Calle de Don Álvaro de Bazán, Nuevos Ministerios-Ríos Rosas, Madrid"
9494,,,"Rios Rosas, Nuevos Ministerios-Ríos Rosas, Madrid"
9472,,,"Calle Santa Engracia, 51, Trafalgar, Madrid"
9441,,,"Calle DE ALBUQUERQUE, Trafalgar, Madrid"
9436,,,"Calle de Cristóbal Bordiú, 53, Nuevos Ministerios-Ríos Rosas, Madrid"
9430,,,"Calle Bravo Murillo, 41, Arapiles, Madrid"
9424,,,"Ríos Rosas, Nuevos Ministerios-Ríos Rosas, Madrid"
9411,,,"Alonso Cano, Nuevos Ministerios-Ríos Rosas, Madrid"
9408,,,"Urb. semisótano con patio, Chamberí, Madrid"
9375,,,"Calle García de Paredes, 4, Trafalgar, Madrid"
9371,,,"Calle Modesto Lafuente, 26, Nuevos Ministerios-Ríos Rosas, Madrid"
9357,,,"Zurbano, 100, Nuevos Ministerios-Ríos Rosas, Madrid"
9356,,,"Calle de Santa Engracia, 143, Nuevos Ministerios-Ríos Rosas, Madrid"
9350,,,"Calle de Modesto Lafuente, Madrid, Nuevos Ministerios-Ríos Rosas, Madrid"
9326,,,"Calle Blasco de Garay, Arapiles, Madrid"
9318,,,"Calle de Santa Engracia, 128, Nuevos Ministerios-Ríos Rosas, Madrid"
9316,,,"Calle de Alenza, Nuevos Ministerios-Ríos Rosas, Madrid"
9311,,,"Calle Eloy Gonzalo, 31, Trafalgar, Madrid"
9308,,,"Calle RODRIGUEZ SAN PEDRO, Gaztambide, Madrid"
9297,,,"Calle Arcipreste de Hita, 14, Gaztambide, Madrid"
9293,,,"Calle de Ríos Rosas, 42, Nuevos Ministerios-Ríos Rosas, Madrid"
9286,,,"Espronceda, Nuevos Ministerios-Ríos Rosas, Madrid"
9284,,,"Calle Santa Engracia, Nuevos Ministerios-Ríos Rosas, Madrid"
9280,,,"Urb. Gaztambide Everyprop.com, Chamberí, Madrid"
9274,,,"Calle Espronceda, 32, Nuevos Ministerios-Ríos Rosas, Madrid"
9273,,,"Calle de Modesto Lafuente, 65, Nuevos Ministerios-Ríos Rosas, Madrid"
9272,,,"Calle alonso cano, Nuevos Ministerios-Ríos Rosas, Madrid"
9235,,,"Urb. Arapiles Everyprop.com, Chamberí, Madrid"
9234,,,"Urb. Trafalgar Everyprop.com, Chamberí, Madrid"
9230,,,"Calle de Modesto Lafuente, 40, Nuevos Ministerios-Ríos Rosas, Madrid"
9219,,,"Calle de Raimundo Fernández Villaverde, 30, Nuevos Ministerios-Ríos Rosas, Madrid"
9206,,,"Paseo SAN FRANCISCO DE SALES, Vallehermoso, Madrid"
9185,,,"Calle de María de Guzmán, 61, Nuevos Ministerios-Ríos Rosas, Madrid"
9179,,,"Raimundo Fernández Villaverde, Nuevos Ministerios-Ríos Rosas, Madrid"
9119,,,"Plaza de San Juan de la Cruz, Nuevos Ministerios-Ríos Rosas, Madrid"
9093,,,"Calle Luis Ruiz, 84, Pueblo Nuevo, Madrid"
9071,,,"Calle Virgen del Val, Concepción, Madrid"
9070,,,"Calle Serrano Galvache, 14, Costillares, Madrid"
9067,,,"Plaza Anguiano, San Juan Bautista, Madrid"
9047,,,"Calle Amos de Escalante s/n, Pueblo Nuevo, Madrid"
9040,,,"Calle de Mesena, Atalaya, Madrid"
9032,,,"Urb. Concepción, Ciudad Lineal, Madrid"
9020,,,"Calle Arturo Soria, 77, San Pascual, Madrid"
9009,,,"Calle Sánchez Díaz, 12, Quintana, Madrid"
9004,,,"Calle Virgen de los Reyes, Concepción, Madrid"
8989,,,"Calle Virgen de Nuria, 3, Concepción, Madrid"
8985,,,"Calle Peloponeso, 16, Pueblo Nuevo, Madrid"
8983,,,"Calle San Telesforo, 28, Pueblo Nuevo, Madrid"
8980,,,"Calle Gómez de Avellaneda, Pueblo Nuevo, Madrid"
8965,,,"Calle Manuel Marañón & Arturo Soria, 176, Colina, Madrid"
8947,,,"Calle Esteban Collantes, 5, Pueblo Nuevo, Madrid"
8943,,,"Calle de Matías Turrión, Colina, Madrid"
8927,,,"Calle del Marqués de Pico Velasco, 60, Concepción, Madrid"
8900,,,"Calle Hermanos Machado, 17, Ventas, Madrid"
8894,,,"Calle de Francisco Giner de los Ríos, San Pascual, Madrid"
8890,,,"Calle Paredes de Nava, Pueblo Nuevo, Madrid"
8882,,,"Urb. Ventas, Ciudad Lineal, Madrid"
8869,,,"Calle Hermanos Machado, 14, Ventas, Madrid"
8866,,,"Calle Juan Pascual, Pueblo Nuevo, Madrid"
8824,,,"Calle San Fidel, 7, Pueblo Nuevo, Madrid"
8815,,,"Calle Esteban Collantes, Pueblo Nuevo, Madrid"
8809,,,"Calle de la Virgen del Puig, Concepción, Madrid"
8808,,,"Calle San Fidel, Pueblo Nuevo, Madrid"
8792,,,"Calle de Fernando Gabriel, 7, Pueblo Nuevo, Madrid"
8769,,,"Calle Carolina Coronado, 29, Pueblo Nuevo, Madrid"
8768,,,"Calle de la Virgen del Puig, 11, Concepción, Madrid"
8765,,,"Calle santa irene , 5, Ventas, Madrid"
8745,,,"Calle de Portugalete, Pueblo Nuevo, Madrid"
8739,,,"Calle Lago Constanza, 55, Pueblo Nuevo, Madrid"
8724,,,"Calle de Emilio Rubin s/n, Colina, Madrid"
8721,,,"Calle Virgen de los Reyes, 6, Concepción, Madrid"
8713,,,"Calle NICOLAS SALMERON, Pueblo Nuevo, Madrid"
8708,,,"Calle Emiliano Barral, San Juan Bautista, Madrid"
8707,,,"Calle Amos de Escalante, Pueblo Nuevo, Madrid"
8704,,,"Calle de Arturo Soria, Madrid, 28027, Madrid Madrid, España, San Pascual, Madrid"
8703,,,"Calle Nicolás Salmerón, Pueblo Nuevo, Madrid"
8697,,,"Calle Gonzalo de Berceo, Pueblo Nuevo, Madrid"
8683,,,"Calle DEL MARQUÉS DE PICO VELASCO, Concepción, Madrid"
8675,,,"Calle Vicente Espinel, Pueblo Nuevo, Madrid"
8669,,,"Urb. JUNTO AL METRO ARTURO SORIA, ADMITE ACTIVIDAD DE NEGOCIO, Ciudad Lineal, Madrid"
8667,,,"Urb. caribe 2, Ciudad Lineal, Madrid"
8653,,,"Virgen de los reyes, Concepción, Madrid"
8637,,,"Calle San Fidel, 73 -57, Pueblo Nuevo, Madrid"
8636,,,"Madres Plaza de Mayo, Pueblo Nuevo, Madrid"
8621,,,"Urb. SOLARIUM COMUNITARIO, Ciudad Lineal, Madrid"
8620,,,"Urb. Solarium comunitario, Ciudad Lineal, Madrid"
8594,,,"Calle de Matías Turrión, 6, Colina, Madrid"
8592,,,"Calle Salvador de Madariaga, 54, San Pascual, Madrid"
8590,,,"Calle San Marcelo, 12, Ventas, Madrid"
8556,,,"Calle Sor María de Ágreda, Ventas, Madrid"
8549,,,"Calle Juan de Arolas, 6, Ventas, Madrid"
8542,,,"Calle Llanos de Escudero, 22, Pueblo Nuevo, Madrid"
8538,,,"Calle Achuri, 3, Pueblo Nuevo, Madrid"
8537,,,"Calle Virgen de los Reyes, 21, Concepción, Madrid"
8536,,,"Calle de la Virgen del Puig s/n, Concepción, Madrid"
8535,,,"Calle Paredes de Nava, 28, Pueblo Nuevo, Madrid"
8528,,,"Calle de la Virgen del Puig, 9, Concepción, Madrid"
8525,,,"Calle Amos de Escalante, 4, Pueblo Nuevo, Madrid"
8522,,,"Calle San Nemesio, 8, San Juan Bautista, Madrid"
8521,,,"Calle Sorzano, 19, San Juan Bautista, Madrid"
8515,,,"Calle lopez de hoyos, Colina, Madrid"
8510,,,"Calle Máximo San Juan, 9, Ventas, Madrid"
8509,,,"Calle Derechos Humanos, 1, San Pascual, Madrid"
8503,,,"Calle NICOLÁS SALMERÓN, Pueblo Nuevo, Madrid"
8501,,,"VIRGEN DE LOS REYES, Concepción, Madrid"
8480,,,"Urb. Arturo Soria - Ciudad Lineal, Ciudad Lineal, Madrid"
8472,,,"Calle antonio calvo, 11, San Pascual, Madrid"
8471,,,"Calle Salvador de Madariaga, 8, San Pascual, Madrid"
8468,,,"Calle Lago Salado, 18, Pueblo Nuevo, Madrid"
8467,,,"Calle Breña, 6, Pueblo Nuevo, Madrid"
8465,,,"Calle Barlovento, 1, Pueblo Nuevo, Madrid"
8464,,,"Plaza Penablanca, 5, Quintana, Madrid"
8461,,,"Calle de Matías Turrión, 20, Colina, Madrid"
8451,,,"Calle Emilio Ferrari, 62, Pueblo Nuevo, Madrid"
8448,,,"Calle Llanos de Escudero, 12, Pueblo Nuevo, Madrid"
8446,,,"Calle la Española, 7, Pueblo Nuevo, Madrid"
8436,,,"Calle Peloponeso, 5, Pueblo Nuevo, Madrid"
8434,,,"Calle María Zambrano, San Pascual, Madrid"
8433,,,"Calle los Realejos, Pueblo Nuevo, Madrid"
8432,,,"Calle Ignacio Ellacuría, 12, Ventas, Madrid"
8413,,,"Calle Esteban Collantes, 21, Pueblo Nuevo, Madrid"
8405,,,"Calle Pedro Antonio de Alarcón, 11, Pueblo Nuevo, Madrid"
8402,,,"Calle Emiliano Barral, 6, San Juan Bautista, Madrid"
8400,,,"Calle Sorzano, 25, San Juan Bautista, Madrid"
8395,,,"Calle de la Virgen del Puig, 5, Concepción, Madrid"
8379,,,"Calle Francisco Villaespesa, 43, Ventas, Madrid"
8374,,,"Calle del Marqués de Pico Velasco, 45, Concepción, Madrid"
8372,,,"Calle de Hernández Rubin, 9, San Juan Bautista, Madrid"
8371,,,"Calle Francisco Rioja, 25, Pueblo Nuevo, Madrid"
8360,,,"Calle Lorenzo San Nicolás, 33, Pueblo Nuevo, Madrid"
8320,,,"Calle Germán Pérez Carrasco, 24, Quintana, Madrid"
8319,,,"Calle Virgen de Nuria, 17, Concepción, Madrid"
8316,,,"Calle la Española, 5, Pueblo Nuevo, Madrid"
8302,,,"Calle Vázquez de Mella, 29, Pueblo Nuevo, Madrid"
8301,,,"Calle José Arcones Gil, 152, Pueblo Nuevo, Madrid"
8284,,,"Calle Gómez de Avellaneda, 23, Pueblo Nuevo, Madrid"
8283,,,"Calle Vicente Espinel, Madrid, 12, Pueblo Nuevo, Madrid"
8279,,,"Calle RÍO NERVIÓN, Pueblo Nuevo, Madrid"
8276,,,"Calle Concejal Julio Gómez, Quintana, Madrid"
8262,,,"Calle Salvador de Madariaga, San Pascual, Madrid"
8258,,,"PABLO LAGARGUE, Ventas, Madrid"
8255,,,"Calle San Samuel, 2, Ventas, Madrid"
8251,,,"Calle de hermanos machado, Ventas, Madrid"
8230,,,"Calle Luis Ruiz, 65, Pueblo Nuevo, Madrid"
8221,,,"Calle Idioma Esperanto, 22, Pueblo Nuevo, Madrid"
8205,,,"Calle de Mesena, Madrid, Costillares, Madrid"
8196,,,"Calle la Española, 3, Pueblo Nuevo, Madrid"
8191,,,"Calle Hermanos Gómez, 14, Ventas, Madrid"
8184,,,"Calle Antonio Calvo, 5, San Pascual, Madrid"
8167,,,"Calle LAS CAÑAS, Colina, Madrid"
8160,,,"Calle del Río Ulla, Pueblo Nuevo, Madrid"
8110,,,"Calle de las cañas, 3, Colina, Madrid"
8093,,,"san fidel, 17, Pueblo Nuevo, Madrid"
8087,,,"Calle Alcalde López Casero s/n, Concepción, Madrid"
8069,,,"Calle José María Fernández Lanseros, 11, Ventas, Madrid"
8055,,,"Calle Virgen de Los Reyes, Concepción, Madrid"
8035,,,"Calle Astorga s/n, Ventas, Madrid"
8034,,,"Calle ÁNGEL MUÑOZ, San Juan Bautista, Madrid"
8033,,,"Calle Vázquez de Mella, Pueblo Nuevo, Madrid"
8032,,,"Calle Gutierre de Cetina, Pueblo Nuevo, Madrid"
8030,,,"Calle José María Fernández Lanseros, Ventas, Madrid"
8028,,,"Calle Francisco Madariaga, 27, Pueblo Nuevo, Madrid"
8020,,,"Calle Lorenzo San Nicolás, Pueblo Nuevo, Madrid"
8008,,,"Calle San Juan de la Cuesta, 4, Ventas, Madrid"
8003,,,"Urb. b, Ciudad Lineal, Madrid"
7998,,,"Calle Urquiza s/n, Pueblo Nuevo, Madrid"
7956,,,"Urb. ARTURO SORIA, Ciudad Lineal, Madrid"
7934,,,"Calle Peloponeso, 26, Pueblo Nuevo, Madrid"
7932,,,"Calle Andrés Antón y José Barbastre s/n, Ventas, Madrid"
7912,,,"Urb. Concepcion, Ciudad Lineal, Madrid"
7888,,,"Calle Juan de Arolas, Ventas, Madrid"
7873,,,"Plaza Virgen del Romero, Concepción, Madrid"
7840,,,"Calle FRANCISCO HUESCAS, Ventas, Madrid"
7816,,,"Calle Llanos de Escudero, 18, Pueblo Nuevo, Madrid"
7789,,,"Calle San Baldomero, Pueblo Nuevo, Madrid"
